{
  "schema_id": "runecode.protocol.v0.AuditAnchorPresenceGetResponse",
  "schema_version": "0.1.0",
  "request_id": "req-anchor-presence-2",
  "seal_digest": {
    "hash_alg": "sha256",
    "hash": "cccccccccccccccccccccccccccccccccccccccccccccccccccccccccccccccc"
  },
  "presence_mode": "passphrase"
}
